,tweet_id,tweet_time,tweet_text,tweet_url,tweet_entities
0,1254340918884196355,2020-04-26 09:25:54,"Rajesh Bhushan, Secretary, Department of Rural Development appointed as Officer on Special Duty , Department of Health and Family Welfare, Ministry of Health and Family Welfare: Government of India",India,"{'hashtags': [], 'symbols': [], 'user_mentions': [], 'urls': []}"
1,1254340713254277120,2020-04-26 09:25:05,"Preeti Sudan, Secretary of Ministry of Health and Family Welfare gets 3 months extension in service beyond date of her superannuation: Government of India
(file pic) https://t.co/iZiIczUmgT",https://t.co/iZiIczUmgT,"{'hashtags': [], 'symbols': [], 'user_mentions': [], 'urls': [], 'media': [{'id': 1254340652290109442, 'id_str': '1254340652290109442', 'indices': [166, 189], 'media_url': 'http://pbs.twimg.com/media/EWhQLW8VcAI4dMx.png', 'media_url_https': 'https://pbs.twimg.com/media/EWhQLW8VcAI4dMx.png', 'url': 'https://t.co/iZiIczUmgT', 'display_url': 'pic.twitter.com/iZiIczUmgT', 'expanded_url': 'https://twitter.com/ANI/status/1254340713254277120/photo/1', 'type': 'photo', 'sizes': {'medium': {'w': 680, 'h': 383, 'resize': 'fit'}, 'large': {'w': 680, 'h': 383, 'resize': 'fit'}, 'thumb': {'w': 150, 'h': 150, 'resize': 'crop'}, 'small': {'w': 680, 'h': 383, 'resize': 'fit'}}}]}"
2,1254339539700715521,2020-04-26 09:20:25,"There has been no such move at all at any level in govt, nor was it ever contemplated. It has been reiterated time &amp; again. I don't know how this motivated, mischief comes up again &amp; again. There is no move to reduce the retirement age of govt employees: MoS PMO Dr Jitendra Singh https://t.co/VqvmyIXrdJ",https://t.co/VqvmyIXrdJ,"{'hashtags': [], 'symbols': [], 'user_mentions': [], 'urls': [], 'media': [{'id': 1254339355524526080, 'id_str': '1254339355524526080', 'indices': [289, 312], 'media_url': 'http://pbs.twimg.com/media/EWhO_4HU8AAHX_t.jpg', 'media_url_https': 'https://pbs.twimg.com/media/EWhO_4HU8AAHX_t.jpg', 'url': 'https://t.co/VqvmyIXrdJ', 'display_url': 'pic.twitter.com/VqvmyIXrdJ', 'expanded_url': 'https://twitter.com/ANI/status/1254339539700715521/photo/1', 'type': 'photo', 'sizes': {'large': {'w': 1024, 'h': 576, 'resize': 'fit'}, 'thumb': {'w': 150, 'h': 150, 'resize': 'crop'}, 'small': {'w': 680, 'h': 383, 'resize': 'fit'}, 'medium': {'w': 1024, 'h': 576, 'resize': 'fit'}}}]}"
3,1254339214294081537,2020-04-26 09:19:07,#WATCH Maharashtra: Fire breaks out a company in Bhusawal of Jalgaon district. Four fire tenders are present on the spot. https://t.co/FnnxgIu09o,https://t.co/FnnxgIu09o,"{'hashtags': [{'text': 'WATCH', 'indices': [0, 6]}], 'symbols': [], 'user_mentions': [], 'urls': [], 'media': [{'id': 1254336643403636737, 'id_str': '1254336643403636737', 'indices': [122, 145], 'media_url': 'http://pbs.twimg.com/amplify_video_thumb/1254336643403636737/img/gFBT2TpchWDUgu7b.jpg', 'media_url_https': 'https://pbs.twimg.com/amplify_video_thumb/1254336643403636737/img/gFBT2TpchWDUgu7b.jpg', 'url': 'https://t.co/FnnxgIu09o', 'display_url': 'pic.twitter.com/FnnxgIu09o', 'expanded_url': 'https://twitter.com/ANI/status/1254339214294081537/video/1', 'type': 'photo', 'sizes': {'thumb': {'w': 150, 'h': 150, 'resize': 'crop'}, 'large': {'w': 640, 'h': 360, 'resize': 'fit'}, 'medium': {'w': 640, 'h': 360, 'resize': 'fit'}, 'small': {'w': 640, 'h': 360, 'resize': 'fit'}}}]}"
4,1254337102923403265,2020-04-26 09:10:44,"#WATCH Delhi Health Minister Satyendar Jain speaks on Babu Jagjivan Ram Hospital in Jahangirpuri area, where around 40 medical staff have tested positive for #COVID19. https://t.co/uDa3wVDQVD",https://t.co/uDa3wVDQVD,"{'hashtags': [{'text': 'WATCH', 'indices': [0, 6]}, {'text': 'COVID19', 'indices': [158, 166]}], 'symbols': [], 'user_mentions': [], 'urls': [], 'media': [{'id': 1254336336443568128, 'id_str': '1254336336443568128', 'indices': [168, 191], 'media_url': 'http://pbs.twimg.com/amplify_video_thumb/1254336336443568128/img/Sh7NZOV0jlHeQbCx.jpg', 'media_url_https': 'https://pbs.twimg.com/amplify_video_thumb/1254336336443568128/img/Sh7NZOV0jlHeQbCx.jpg', 'url': 'https://t.co/uDa3wVDQVD', 'display_url': 'pic.twitter.com/uDa3wVDQVD', 'expanded_url': 'https://twitter.com/ANI/status/1254337102923403265/video/1', 'type': 'photo', 'sizes': {'thumb': {'w': 150, 'h': 150, 'resize': 'crop'}, 'large': {'w': 720, 'h': 404, 'resize': 'fit'}, 'small': {'w': 680, 'h': 382, 'resize': 'fit'}, 'medium': {'w': 720, 'h': 404, 'resize': 'fit'}}}]}"
5,1254332738066235393,2020-04-26 08:53:23,"Jagjivan Ram Hospital is located in Jahangirpuri. Many positive cases have come from the area, this number also includes some staff of the hospital. There are around 40 such staff: Delhi Health Minister Satyendar Jain #COVID19 https://t.co/2Lk20CAqrU",https://t.co/2Lk20CAqrU,"{'hashtags': [{'text': 'COVID19', 'indices': [218, 226]}], 'symbols': [], 'user_mentions': [], 'urls': [], 'media': [{'id': 1254332455454035968, 'id_str': '1254332455454035968', 'indices': [227, 250], 'media_url': 'http://pbs.twimg.com/media/EWhIuPWU0AA8aQ1.jpg', 'media_url_https': 'https://pbs.twimg.com/media/EWhIuPWU0AA8aQ1.jpg', 'url': 'https://t.co/2Lk20CAqrU', 'display_url': 'pic.twitter.com/2Lk20CAqrU', 'expanded_url': 'https://twitter.com/ANI/status/1254332738066235393/photo/1', 'type': 'photo', 'sizes': {'thumb': {'w': 150, 'h': 150, 'resize': 'crop'}, 'small': {'w': 680, 'h': 383, 'resize': 'fit'}, 'large': {'w': 1024, 'h': 576, 'resize': 'fit'}, 'medium': {'w': 1024, 'h': 576, 'resize': 'fit'}}}]}"
6,1254332315922120704,2020-04-26 08:51:43,"RT @AHindinews: हरियाणा:बेमौसम बारिश के चलते खेतों,अनाज मंडियों में किसानों की फसल खराब हो रही है।एस.आर.कलसी,असिस्टेंट सचिव,मार्केट कमेटी,…","कमेटी,…","{'hashtags': [], 'symbols': [], 'user_mentions': [{'screen_name': 'AHindinews', 'name': 'ANI_HindiNews', 'id': 1199243479714390021, 'id_str': '1199243479714390021', 'indices': [3, 14]}], 'urls': []}"
7,1254331459944374272,2020-04-26 08:48:19,"An unidentified Pakistani national was trying to enter Indian border through fencing. Border Security Force personnel first warned him, but he did not stop following which they shot him. Incident happened at Pulmora Post, early morning today: Gurpratap Singh Sahota, DSP   #Punjab https://t.co/MRIr3xgPvM",https://t.co/MRIr3xgPvM,"{'hashtags': [{'text': 'Punjab', 'indices': [273, 280]}], 'symbols': [], 'user_mentions': [], 'urls': [], 'media': [{'id': 1254330551894335489, 'id_str': '1254330551894335489', 'indices': [281, 304], 'media_url': 'http://pbs.twimg.com/media/EWhG_cCU4AErW4P.jpg', 'media_url_https': 'https://pbs.twimg.com/media/EWhG_cCU4AErW4P.jpg', 'url': 'https://t.co/MRIr3xgPvM', 'display_url': 'pic.twitter.com/MRIr3xgPvM', 'expanded_url': 'https://twitter.com/ANI/status/1254331459944374272/photo/1', 'type': 'photo', 'sizes': {'thumb': {'w': 150, 'h': 150, 'resize': 'crop'}, 'small': {'w': 680, 'h': 383, 'resize': 'fit'}, 'large': {'w': 1024, 'h': 576, 'resize': 'fit'}, 'medium': {'w': 1024, 'h': 576, 'resize': 'fit'}}}]}"
8,1254330876579717120,2020-04-26 08:45:59,"Right now the RNA extraction is done manually. State govt has ordered 2 Automatic RNA extraction machines, one for RMRI &amp; the other for IGMS. They have been ordered from Singapore, we expect them to be here by month-end or the 1st week of May: Principal Secretary of Health, Bihar https://t.co/ZrbkoWjRuT",https://t.co/ZrbkoWjRuT,"{'hashtags': [], 'symbols': [], 'user_mentions': [], 'urls': [], 'media': [{'id': 1254330423204691968, 'id_str': '1254330423204691968', 'indices': [285, 308], 'media_url': 'http://pbs.twimg.com/media/EWhG38oUwAAJo0U.jpg', 'media_url_https': 'https://pbs.twimg.com/media/EWhG38oUwAAJo0U.jpg', 'url': 'https://t.co/ZrbkoWjRuT', 'display_url': 'pic.twitter.com/ZrbkoWjRuT', 'expanded_url': 'https://twitter.com/ANI/status/1254330876579717120/photo/1', 'type': 'photo', 'sizes': {'thumb': {'w': 150, 'h': 150, 'resize': 'crop'}, 'large': {'w': 1024, 'h': 576, 'resize': 'fit'}, 'small': {'w': 680, 'h': 383, 'resize': 'fit'}, 'medium': {'w': 1024, 'h': 576, 'resize': 'fit'}}}]}"
9,1254329631152336899,2020-04-26 08:41:03,"A CBI team has taken Kapil and Dhiraj Wadhawan into custody. Satara Police has given them all required assistance and an escort vehicle with 1+3 guard upto Mumbai, on a written request. The arrest procedures are going on: Maharashtra Home Minister Anil Deshmukh (file pic) https://t.co/GcapWb3Clj",https://t.co/GcapWb3Clj,"{'hashtags': [], 'symbols': [], 'user_mentions': [], 'urls': [], 'media': [{'id': 1254329567877099520, 'id_str': '1254329567877099520', 'indices': [273, 296], 'media_url': 'http://pbs.twimg.com/media/EWhGGKSVcAA9rjf.jpg', 'media_url_https': 'https://pbs.twimg.com/media/EWhGGKSVcAA9rjf.jpg', 'url': 'https://t.co/GcapWb3Clj', 'display_url': 'pic.twitter.com/GcapWb3Clj', 'expanded_url': 'https://twitter.com/ANI/status/1254329631152336899/photo/1', 'type': 'photo', 'sizes': {'thumb': {'w': 150, 'h': 150, 'resize': 'crop'}, 'medium': {'w': 1200, 'h': 675, 'resize': 'fit'}, 'large': {'w': 1200, 'h': 675, 'resize': 'fit'}, 'small': {'w': 680, 'h': 383, 'resize': 'fit'}}}]}"
10,1254329081539129344,2020-04-26 08:38:52,"Delhi: Jewellery shops in Karol Bagh remain closed and markets wear a deserted look, amid lockdown due to #COVID19.  #AkshayaTritiya https://t.co/s5OHwWzhTp",https://t.co/s5OHwWzhTp,"{'hashtags': [{'text': 'COVID19', 'indices': [106, 114]}, {'text': 'AkshayaTritiya', 'indices': [117, 132]}], 'symbols': [], 'user_mentions': [], 'urls': [], 'media': [{'id': 1254327774405255170, 'id_str': '1254327774405255170', 'indices': [133, 156], 'media_url': 'http://pbs.twimg.com/media/EWhEdxFU4AIUyfy.jpg', 'media_url_https': 'https://pbs.twimg.com/media/EWhEdxFU4AIUyfy.jpg', 'url': 'https://t.co/s5OHwWzhTp', 'display_url': 'pic.twitter.com/s5OHwWzhTp', 'expanded_url': 'https://twitter.com/ANI/status/1254329081539129344/photo/1', 'type': 'photo', 'sizes': {'thumb': {'w': 150, 'h': 150, 'resize': 'crop'}, 'small': {'w': 680, 'h': 383, 'resize': 'fit'}, 'large': {'w': 1024, 'h': 576, 'resize': 'fit'}, 'medium': {'w': 1024, 'h': 576, 'resize': 'fit'}}}]}"
11,1254327477167685632,2020-04-26 08:32:29,It is painful that 2 of our policemen have sacrificed their lives. I pay homage to them. Their families will be supported as per the government policy: Maharashtra CM Uddhav Thackeray https://t.co/jKyiZFdTEI,https://t.co/jKyiZFdTEI,"{'hashtags': [], 'symbols': [], 'user_mentions': [], 'urls': [], 'media': [{'id': 1254327448436527104, 'id_str': '1254327448436527104', 'indices': [184, 207], 'media_url': 'http://pbs.twimg.com/media/EWhEKywU0AAkNMG.jpg', 'media_url_https': 'https://pbs.twimg.com/media/EWhEKywU0AAkNMG.jpg', 'url': 'https://t.co/jKyiZFdTEI', 'display_url': 'pic.twitter.com/jKyiZFdTEI', 'expanded_url': 'https://twitter.com/ANI/status/1254327477167685632/photo/1', 'type': 'photo', 'sizes': {'medium': {'w': 1024, 'h': 576, 'resize': 'fit'}, 'large': {'w': 1024, 'h': 576, 'resize': 'fit'}, 'thumb': {'w': 150, 'h': 150, 'resize': 'crop'}, 'small': {'w': 680, 'h': 383, 'resize': 'fit'}}}]}"
12,1254326192070701057,2020-04-26 08:27:23,"We have 80% patients who are asymptomatic and 20% are there who have mild, serious or critical symptoms. We have to see how these people are also saved. Those who are hiding it and not getting tested, if you have symptoms please go and get tested: Maharashtra CM Uddhav Thackeray https://t.co/iQ28twGRIw",https://t.co/iQ28twGRIw,"{'hashtags': [], 'symbols': [], 'user_mentions': [], 'urls': [], 'media': [{'id': 1254326149611548674, 'id_str': '1254326149611548674', 'indices': [280, 303], 'media_url': 'http://pbs.twimg.com/media/EWhC_MQUcAIpYux.jpg', 'media_url_https': 'https://pbs.twimg.com/media/EWhC_MQUcAIpYux.jpg', 'url': 'https://t.co/iQ28twGRIw', 'display_url': 'pic.twitter.com/iQ28twGRIw', 'expanded_url': 'https://twitter.com/ANI/status/1254326192070701057/photo/1', 'type': 'photo', 'sizes': {'thumb': {'w': 150, 'h': 150, 'resize': 'crop'}, 'small': {'w': 680, 'h': 383, 'resize': 'fit'}, 'large': {'w': 1024, 'h': 576, 'resize': 'fit'}, 'medium': {'w': 1024, 'h': 576, 'resize': 'fit'}}}]}"
13,1254325660283138054,2020-04-26 08:25:16,"376 J&amp;K students in Kota set to return tomorrow. All arrangements finalised. This follows recent return of students &amp; others who were in Jaisalmer and other places. Appeal - Please be patient. Govt is working hard to facilitate all: Rohit Kansal, Principal Secretary(Planning) J&amp;K https://t.co/esvE8rw5SG",https://t.co/esvE8rw5SG,"{'hashtags': [], 'symbols': [], 'user_mentions': [], 'urls': [], 'media': [{'id': 1254325513834754051, 'id_str': '1254325513834754051', 'indices': [293, 316], 'media_url': 'http://pbs.twimg.com/media/EWhCaLzUcAMv28j.jpg', 'media_url_https': 'https://pbs.twimg.com/media/EWhCaLzUcAMv28j.jpg', 'url': 'https://t.co/esvE8rw5SG', 'display_url': 'pic.twitter.com/esvE8rw5SG', 'expanded_url': 'https://twitter.com/ANI/status/1254325660283138054/photo/1', 'type': 'photo', 'sizes': {'thumb': {'w': 150, 'h': 150, 'resize': 'crop'}, 'small': {'w': 680, 'h': 313, 'resize': 'fit'}, 'large': {'w': 758, 'h': 349, 'resize': 'fit'}, 'medium': {'w': 758, 'h': 349, 'resize': 'fit'}}}]}"
14,1254324742376521736,2020-04-26 08:21:37,"I assure the migrant labourers that I am talking to the centre and whatever is possible will be done soon. One thing is sure that trains are not starting because we don't want a crowd, otherwise, lockdown will be needed to be further extended: Maharashtra CM Uddhav Thackeray https://t.co/PCXzWdZxn3",https://t.co/PCXzWdZxn3,"{'hashtags': [], 'symbols': [], 'user_mentions': [], 'urls': [], 'media': [{'id': 1254324670154723329, 'id_str': '1254324670154723329', 'indices': [276, 299], 'media_url': 'http://pbs.twimg.com/media/EWhBpE2U0AESy2b.jpg', 'media_url_https': 'https://pbs.twimg.com/media/EWhBpE2U0AESy2b.jpg', 'url': 'https://t.co/PCXzWdZxn3', 'display_url': 'pic.twitter.com/PCXzWdZxn3', 'expanded_url': 'https://twitter.com/ANI/status/1254324742376521736/photo/1', 'type': 'photo', 'sizes': {'thumb': {'w': 150, 'h': 150, 'resize': 'crop'}, 'large': {'w': 1024, 'h': 576, 'resize': 'fit'}, 'small': {'w': 680, 'h': 383, 'resize': 'fit'}, 'medium': {'w': 1024, 'h': 576, 'resize': 'fit'}}}]}"
15,1254322449207836672,2020-04-26 08:12:30,Delhi: Union Health Minister Dr Harsh Vardhan visits AIIMS Trauma Centre which has been converted into dedicated COVID-19 hospital https://t.co/NMMBVJlXVy,https://t.co/NMMBVJlXVy,"{'hashtags': [], 'symbols': [], 'user_mentions': [], 'urls': [], 'media': [{'id': 1254322212057739264, 'id_str': '1254322212057739264', 'indices': [131, 154], 'media_url': 'http://pbs.twimg.com/media/EWg_Z_uVcAAWcuM.jpg', 'media_url_https': 'https://pbs.twimg.com/media/EWg_Z_uVcAAWcuM.jpg', 'url': 'https://t.co/NMMBVJlXVy', 'display_url': 'pic.twitter.com/NMMBVJlXVy', 'expanded_url': 'https://twitter.com/ANI/status/1254322449207836672/photo/1', 'type': 'photo', 'sizes': {'medium': {'w': 1200, 'h': 675, 'resize': 'fit'}, 'thumb': {'w': 150, 'h': 150, 'resize': 'crop'}, 'small': {'w': 680, 'h': 383, 'resize': 'fit'}, 'large': {'w': 1280, 'h': 720, 'resize': 'fit'}}}]}"
16,1254321640206471168,2020-04-26 08:09:17,"Today is #AkshayaTritiya but there's no celebration, I'm thankful for that. 
I want to appeal that it's #Ramzan but don't go out to pray. Everyone's asking where's God. God is in everyone who's serving us in these hard times -Police, Doctors, cleanliness workers &amp; others: Maha CM https://t.co/Hy7SAay17C",https://t.co/Hy7SAay17C,"{'hashtags': [{'text': 'AkshayaTritiya', 'indices': [9, 24]}, {'text': 'Ramzan', 'indices': [104, 111]}], 'symbols': [], 'user_mentions': [], 'urls': [], 'media': [{'id': 1254321327688712192, 'id_str': '1254321327688712192', 'indices': [285, 308], 'media_url': 'http://pbs.twimg.com/media/EWg-mhMVAAAyLea.jpg', 'media_url_https': 'https://pbs.twimg.com/media/EWg-mhMVAAAyLea.jpg', 'url': 'https://t.co/Hy7SAay17C', 'display_url': 'pic.twitter.com/Hy7SAay17C', 'expanded_url': 'https://twitter.com/ANI/status/1254321640206471168/photo/1', 'type': 'photo', 'sizes': {'thumb': {'w': 150, 'h': 150, 'resize': 'crop'}, 'large': {'w': 1024, 'h': 576, 'resize': 'fit'}, 'small': {'w': 680, 'h': 383, 'resize': 'fit'}, 'medium': {'w': 1024, 'h': 576, 'resize': 'fit'}}}]}"
17,1254317900418224129,2020-04-26 07:54:26,"Uttarakhand: The portals of Gangotri temple in Uttarkashi district were opened today at 12:35 PM. No devotees or pilgrims were present at the time, in the light of #COVID19 pandemic. https://t.co/bO0QWEkrCo",https://t.co/bO0QWEkrCo,"{'hashtags': [{'text': 'COVID19', 'indices': [164, 172]}], 'symbols': [], 'user_mentions': [], 'urls': [], 'media': [{'id': 1254317107321294853, 'id_str': '1254317107321294853', 'indices': [183, 206], 'media_url': 'http://pbs.twimg.com/media/EWg6w3GU0AUgmVd.jpg', 'media_url_https': 'https://pbs.twimg.com/media/EWg6w3GU0AUgmVd.jpg', 'url': 'https://t.co/bO0QWEkrCo', 'display_url': 'pic.twitter.com/bO0QWEkrCo', 'expanded_url': 'https://twitter.com/ANI/status/1254317900418224129/photo/1', 'type': 'photo', 'sizes': {'thumb': {'w': 150, 'h': 150, 'resize': 'crop'}, 'medium': {'w': 1200, 'h': 800, 'resize': 'fit'}, 'large': {'w': 1280, 'h': 853, 'resize': 'fit'}, 'small': {'w': 680, 'h': 453, 'resize': 'fit'}}}]}"
18,1254317548276813827,2020-04-26 07:53:02,Kerala: Priests in the Thiruvambadi and Paramekkavu Temples performed the flag hoisting ritual marking the beginning of the Thrissur Pooram festival in Thrissur. This year the 7-day festival will be celebrated without any public gathering due to #COVID19 lockdown. https://t.co/PCEEdELcx7,https://t.co/PCEEdELcx7,"{'hashtags': [{'text': 'COVID19', 'indices': [246, 254]}], 'symbols': [], 'user_mentions': [], 'urls': [], 'media': [{'id': 1254312868415066113, 'id_str': '1254312868415066113', 'indices': [265, 288], 'media_url': 'http://pbs.twimg.com/media/EWg26H8U0AEsN-0.jpg', 'media_url_https': 'https://pbs.twimg.com/media/EWg26H8U0AEsN-0.jpg', 'url': 'https://t.co/PCEEdELcx7', 'display_url': 'pic.twitter.com/PCEEdELcx7', 'expanded_url': 'https://twitter.com/ANI/status/1254317548276813827/photo/1', 'type': 'photo', 'sizes': {'thumb': {'w': 150, 'h': 150, 'resize': 'crop'}, 'medium': {'w': 1024, 'h': 576, 'resize': 'fit'}, 'large': {'w': 1024, 'h': 576, 'resize': 'fit'}, 'small': {'w': 680, 'h': 383, 'resize': 'fit'}}}]}"
19,1254316215486623745,2020-04-26 07:47:44,"First reported death of a member of our medical fraternity in the state - Assistant Director of Health Services, Central Medical Stores, West Bengal Health Services - who was tested positive for #COVID19, reported in the early hours of 26th April 2020: West Bengal Doctors Forum",Forum,"{'hashtags': [{'text': 'COVID19', 'indices': [195, 203]}], 'symbols': [], 'user_mentions': [], 'urls': []}"
20,1254313906719391744,2020-04-26 07:38:34,1 more #COVID19 positive case reported in Uttarakhand today. The total number of positive cases in the state rises to 50: Uttarakhand State Control Room #COVID19 https://t.co/2MdObNzHHM,https://t.co/2MdObNzHHM,"{'hashtags': [{'text': 'COVID19', 'indices': [7, 15]}, {'text': 'COVID19', 'indices': [153, 161]}], 'symbols': [], 'user_mentions': [], 'urls': [{'url': 'https://t.co/2MdObNzHHM', 'expanded_url': 'https://twitter.com/ANI/status/1254306199459303426', 'display_url': 'twitter.com/ANI/status/125…', 'indices': [162, 185]}]}"
21,1254312519759511555,2020-04-26 07:33:03,"Madhya Pradesh: BJP National General Secretary and party's Central Observer for West Bengal, Kailash Vijayvargiya sits in protest at his residence in Indore, against West Bengal government and Chief Minister Mamata Banerjee over #COVID19 https://t.co/9lJ4UvkCwx",https://t.co/9lJ4UvkCwx,"{'hashtags': [{'text': 'COVID19', 'indices': [229, 237]}], 'symbols': [], 'user_mentions': [], 'urls': [], 'media': [{'id': 1254311424257429507, 'id_str': '1254311424257429507', 'indices': [238, 261], 'media_url': 'http://pbs.twimg.com/media/EWg1mECUEAMR1Ti.jpg', 'media_url_https': 'https://pbs.twimg.com/media/EWg1mECUEAMR1Ti.jpg', 'url': 'https://t.co/9lJ4UvkCwx', 'display_url': 'pic.twitter.com/9lJ4UvkCwx', 'expanded_url': 'https://twitter.com/ANI/status/1254312519759511555/photo/1', 'type': 'photo', 'sizes': {'thumb': {'w': 150, 'h': 150, 'resize': 'crop'}, 'large': {'w': 1024, 'h': 576, 'resize': 'fit'}, 'medium': {'w': 1024, 'h': 576, 'resize': 'fit'}, 'small': {'w': 680, 'h': 383, 'resize': 'fit'}}}]}"
22,1254311182992904193,2020-04-26 07:27:44,"Delhi: Union Minister Babul Supriyo, BJP MPs from West Bengal and other party leaders protest against West Bengal government and Chief Minister Mamata Banerjee, over #COVID19 https://t.co/pZPvTYb2Uw",https://t.co/pZPvTYb2Uw,"{'hashtags': [{'text': 'COVID19', 'indices': [166, 174]}], 'symbols': [], 'user_mentions': [], 'urls': [], 'media': [{'id': 1254309373414748160, 'id_str': '1254309373414748160', 'indices': [175, 198], 'media_url': 'http://pbs.twimg.com/media/EWgzusDUMAAjNHt.jpg', 'media_url_https': 'https://pbs.twimg.com/media/EWgzusDUMAAjNHt.jpg', 'url': 'https://t.co/pZPvTYb2Uw', 'display_url': 'pic.twitter.com/pZPvTYb2Uw', 'expanded_url': 'https://twitter.com/ANI/status/1254311182992904193/photo/1', 'type': 'photo', 'sizes': {'small': {'w': 680, 'h': 383, 'resize': 'fit'}, 'thumb': {'w': 150, 'h': 150, 'resize': 'crop'}, 'large': {'w': 1920, 'h': 1080, 'resize': 'fit'}, 'medium': {'w': 1200, 'h': 675, 'resize': 'fit'}}}]}"
23,1254309015820988416,2020-04-26 07:19:07,"Karnataka: Jewellery shops in Hubli remain closed and markets wear a deserted look, amid lockdown due to #COVID19.  #AkshayaTritiya https://t.co/DkTyWMbxcN",https://t.co/DkTyWMbxcN,"{'hashtags': [{'text': 'COVID19', 'indices': [105, 113]}, {'text': 'AkshayaTritiya', 'indices': [116, 131]}], 'symbols': [], 'user_mentions': [], 'urls': [], 'media': [{'id': 1254307163696054272, 'id_str': '1254307163696054272', 'indices': [132, 155], 'media_url': 'http://pbs.twimg.com/media/EWgxuENUwAAC5cH.jpg', 'media_url_https': 'https://pbs.twimg.com/media/EWgxuENUwAAC5cH.jpg', 'url': 'https://t.co/DkTyWMbxcN', 'display_url': 'pic.twitter.com/DkTyWMbxcN', 'expanded_url': 'https://twitter.com/ANI/status/1254309015820988416/photo/1', 'type': 'photo', 'sizes': {'medium': {'w': 1200, 'h': 675, 'resize': 'fit'}, 'thumb': {'w': 150, 'h': 150, 'resize': 'crop'}, 'small': {'w': 680, 'h': 383, 'resize': 'fit'}, 'large': {'w': 1280, 'h': 720, 'resize': 'fit'}}}]}"
24,1254306199459303426,2020-04-26 07:07:56,"#Uttarakhand A nursing staff at the hospital has tested positive for Coronavirus: All India Institute of Medical Sciences, Rishikesh PRO Harish Thapliyal",Thapliyal,"{'hashtags': [{'text': 'Uttarakhand', 'indices': [0, 12]}], 'symbols': [], 'user_mentions': [], 'urls': []}"
25,1254305389446914048,2020-04-26 07:04:43,"Madhya Pradesh: Bhopal Division of Indian Railways has converted 74 railways coaches into isolation wards.
#COVID19 https://t.co/6kE8JY6Q0L",https://t.co/6kE8JY6Q0L,"{'hashtags': [{'text': 'COVID19', 'indices': [107, 115]}], 'symbols': [], 'user_mentions': [], 'urls': [], 'media': [{'id': 1254305330483191809, 'id_str': '1254305330483191809', 'indices': [116, 139], 'media_url': 'http://pbs.twimg.com/media/EWgwDW9UYAEsc97.jpg', 'media_url_https': 'https://pbs.twimg.com/media/EWgwDW9UYAEsc97.jpg', 'url': 'https://t.co/6kE8JY6Q0L', 'display_url': 'pic.twitter.com/6kE8JY6Q0L', 'expanded_url': 'https://twitter.com/ANI/status/1254305389446914048/photo/1', 'type': 'photo', 'sizes': {'thumb': {'w': 150, 'h': 150, 'resize': 'crop'}, 'large': {'w': 1920, 'h': 1080, 'resize': 'fit'}, 'small': {'w': 680, 'h': 383, 'resize': 'fit'}, 'medium': {'w': 1200, 'h': 675, 'resize': 'fit'}}}]}"
26,1254305104305496065,2020-04-26 07:03:35,"2 new cases of #COVID19 reported from Parsa district in Nepal. Total toll now stands at 51 with 12 recovered: Ministry of Health and Population, Nepal https://t.co/7fnCURmCr3",https://t.co/7fnCURmCr3,"{'hashtags': [{'text': 'COVID19', 'indices': [15, 23]}], 'symbols': [], 'user_mentions': [], 'urls': [], 'media': [{'id': 1254304960054886400, 'id_str': '1254304960054886400', 'indices': [151, 174], 'media_url': 'http://pbs.twimg.com/media/EWgvtzAVAAAj1pH.jpg', 'media_url_https': 'https://pbs.twimg.com/media/EWgvtzAVAAAj1pH.jpg', 'url': 'https://t.co/7fnCURmCr3', 'display_url': 'pic.twitter.com/7fnCURmCr3', 'expanded_url': 'https://twitter.com/ANI/status/1254305104305496065/photo/1', 'type': 'photo', 'sizes': {'thumb': {'w': 86, 'h': 86, 'resize': 'crop'}, 'large': {'w': 490, 'h': 86, 'resize': 'fit'}, 'medium': {'w': 490, 'h': 86, 'resize': 'fit'}, 'small': {'w': 490, 'h': 86, 'resize': 'fit'}}}]}"
27,1254304583574306817,2020-04-26 07:01:31,"J&amp;K: Trainees at 'Jan Shikshan Sansthan' in Kupwara - skill institute under Ministry of Skill Development&amp;Entrepreneurship, are making masks for distribution among people&amp;different voluntary sectors. They've distributed around 2000 masks so far&amp;1000 masks are currently being made https://t.co/dF3koca7ne",https://t.co/dF3koca7ne,"{'hashtags': [], 'symbols': [], 'user_mentions': [], 'urls': [], 'media': [{'id': 1254296387350454273, 'id_str': '1254296387350454273', 'indices': [297, 320], 'media_url': 'http://pbs.twimg.com/media/EWgn6zMUYAEQ9ke.jpg', 'media_url_https': 'https://pbs.twimg.com/media/EWgn6zMUYAEQ9ke.jpg', 'url': 'https://t.co/dF3koca7ne', 'display_url': 'pic.twitter.com/dF3koca7ne', 'expanded_url': 'https://twitter.com/ANI/status/1254304583574306817/photo/1', 'type': 'photo', 'sizes': {'thumb': {'w': 150, 'h': 150, 'resize': 'crop'}, 'small': {'w': 680, 'h': 383, 'resize': 'fit'}, 'large': {'w': 1024, 'h': 576, 'resize': 'fit'}, 'medium': {'w': 1024, 'h': 576, 'resize': 'fit'}}}]}"
